### ISSUE TITLE
USRP source port is different to listening port.

### ISSUE THREAD

**Issue by vk3jed** [vk2gpu/thelinkbox#2]
In most USRP implementations, the source port for transmitted USRP packets is the port that the USRP capable application is listening on.  For example, if the USRP peer is configured to listen on port 62100 and transmit on 62200, traffic is sent as follows:

Local (62100) -> remote (62200).

Other applications (AllStar, Analog_Bridge, Analog_Reflector, USRP2M17, USRP2P25, to name a few) conform to the above.

In at least some instances, tlb sends traffic from a random port, rather than the port it's listening on.  This may be a cosmetic issue, as at least some implementations (DVSwitch's Analog_Bridge and possibly Analog_Reflector) still work when sent traffic from the peer's IP and random port.  

Confirmed case is using the following configuration:
Host OS Ubuntu 20.04 LTS with 5.19 kernel
tlb USRP configuration:
Local port 62201
Remote port 62101
Remote IP 127.0.0.1
Traffic sent by tlb was coming from a random port in the 40000 - 50000 range, rather than 62201.

Another confirmed case:
Host OS Debian 11 with kernel 5.10.0-21-amd64
tlb USRP configuration
Local port 62201
Remote port 62101
Remote IP (on a different host)
Sample tcpdump of traffic.
root@44net:/usr/local/etc# tcpdump -n -i enp1s0 -p udp port 62101
tcpdump: verbose output suppressed, use -v[v]... for full protocol decode
listening on enp1s0, link-type EN10MB (Ethernet), snapshot length 262144 bytes
09:26:02.831092 IP 67.219.104.145.51732 > 112.213.34.65.62101: UDP, length 51
09:26:02.831114 IP 67.219.104.145.51732 > 112.213.34.65.62101: UDP, length 352
09:26:02.831122 IP 67.219.104.145.51732 > 112.213.34.65.62101: UDP, length 352
09:26:02.831125 IP 67.219.104.145.51732 > 112.213.34.65.62101: UDP, length 352
09:26:02.831128 IP 67.219.104.145.51732 > 112.213.34.65.62101: UDP, length 352
09:26:02.831132 IP 67.219.104.145.51732 > 112.213.34.65.62101: UDP, length 352

It is uncertain what the implications of this behaviour is.  So far, there has been no discernible impact.
